Offence,Mean-hours,SD-hours,Mean-units,SD-units,Event-Priority
homicide,159.468,15.947,8,3,1
attempted murder,93.086,9.309,4,4,1
rape of a male child under 16,77.896,7.79,4,4,1
rape of a female child under 16,77.663,7.766,4,4,1
interfering with a motor vehicle,66,6,4,4,1
rape of a female aged 16 and over,65.586,6.559,4,4,1
rape of a female child under 13,64.502,6.45,3,3,1
rape of a male aged 16 and over,59.508,5.951,3,3,1
rape of a male child under 13,47.945,4.795,2,2,1
aggravated burglary business and community,45.773,4.577,2,2,1
aggravated burglary residential,45.773,4.577,2,2,1
assault with intent to cause serious harm,40.695,4.069,2,2,1
conspiracy to murder,40.484,4.048,2,2,1
endangering life,28.94,2.894,2,2,1
kidnapping,24.336,2.434,2,2,1
sexual assault on a female child under 13,24.239,2.424,2,2,1
incest or familial sexual offences,22.447,2.245,2,2,1
modern slavery,21.381,2.138,2,2,1
profiting from or concealing knowledge of the proceeds of crime,21.128,2.113,2,2,1
causing sexual activity without consent,21.095,2.109,2,2,1
other miscellaneous sexual offences,20.538,2.054,2,2,2
other notifiable offences,20.538,2.054,2,2,2
causing death or serious injury by dangerous driving,20.456,2.046,2,2,2
causing or allowing death of child or vulnerable person,20.456,2.046,2,2,2
abuse of children through sexual exploitation,18.785,1.879,2,2,2
sexual assault on a male child under 13,17.245,1.725,2,2,2
arson endangering life,16.524,1.652,2,2,2
sexual activity involving a child under 13,16.474,1.647,2,2,2
anti-social behaviour,1,1.635,1,1,2
robbery of business property,15.993,1.599,2,2,2
robbery of personal property,15.993,1.599,2,2,2
sexual activity etc with a person with a mental disorder,15.993,1.599,2,2,2
sexual activity involving child under 16,15.993,1.599,2,2,2
blackmail,15.716,1.572,2,2,2
sexual assault on a male aged 13 and over,15.349,1.535,2,2,2
causing death by driving: unlicensed or disqualified or uninsured drivers,13.814,1.381,2,2,2
possession of firearms with intent,12.331,1.233,2,2,2
trafficking in controlled drugs,10.259,1.026,2,2,2
attempted burglary business and community,9.308,0.931,1,1,3
attempted burglary residential,9.308,0.931,1,1,3
attempted distraction burglary residential,9.308,0.931,1,1,3
burglary business and community,9.308,0.931,1,1,3
burglary residential,9.308,0.931,1,1,3
distraction burglary residential,9.308,0.931,1,1,3
sexual grooming,9.259,0.926,1,1,3
sexual assault on a female aged 13 and over,9.181,0.918,1,1,3
possession of firearms offences,8.244,0.824,1,1,3
assault with injury on a constable,8.028,0.803,1,1,3
threat or possession with intent to commit criminal damage,7.367,0.737,1,1,3
violent disorder,6.97,0.697,1,1,3
racially or religiously aggravated assault with injury,6.258,0.626,1,1,3
child abduction,5.796,0.58,1,1,3
threats to kill,5.506,0.551,1,1,3
abuse of position of trust of a sexual nature,4.813,0.481,1,1,3
offender management act offences,4.141,0.414,1,1,3
bigamy,4.028,0.403,1,1,3
possession of false documents,3.874,0.387,1,1,3
absconding from lawful custody,3.848,0.385,1,1,3
assault with injury,3.783,0.378,1,1,3
arson not endangering life,3.733,0.373,1,1,3
perverting the course of justice,3.375,0.337,1,1,3
other forgery,2.916,0.292,1,1,3
cruelty to children/young persons,2.774,0.277,1,1,3
"making, supplying or possessing articles for use in fraud",2.705,0.271,1,1,3
dangerous driving,2.398,0.24,1,1,3
causing death by careless or inconsiderate driving,2.227,0.223,1,1,3
theft from automatic machine or meter,2.212,0.221,1,1,3
perjury,1.957,0.196,1,1,3
"going equipped for stealing, etc",1.876,0.188,1,1,3
obscene publications etc,1.876,0.188,1,1,3
theft of mail,1.697,0.17,1,1,3
theft from the person,1.608,0.161,1,1,3
theft from vehicle,1.608,0.161,1,1,3
other offences against the state or public order,1.45,0.145,1,1,3
stalking,1.127,0.113,1,1,3
handling stolen goods,1.103,0.11,1,1,3
aggravated vehicle taking,1.069,0.107,1,1,3
possession of article with blade or point,1.061,0.106,1,1,3
possession of other weapons,1.043,0.104,1,1,3
theft in a dwelling other than from an automatic machine or meter,1.028,0.103,1,1,3
theft by an employee,0.986,0.099,1,1,3
exposure and voyeurism,0.798,0.08,1,1,3
racially or religiously aggravated harassment,0.75,0.075,1,1,3
other theft,0.736,0.074,1,1,3
harassment,0.722,0.072,1,1,3
racially or religiously aggravated assault without injury,0.615,0.062,1,1,3
theft or unauthorised taking of a pedal cycle,0.304,0.03,1,1,3
theft or unauthorised taking of motor vehicle,0.304,0.03,1,1,3
malicious communications,0.303,0.03,1,1,3
racially or religiously aggravated criminal damage,0.28,0.028,1,1,3
assault without injury,0.27,0.027,1,1,3
"disclosure, obstruction, false or misleading statements etc",0.258,0.026,1,1,3
"racially or religiously aggravated public fear, alarm or distress",0.255,0.026,1,1,3
shoplifting,0.237,0.024,1,1,3
other drug offences,0.181,0.018,1,1,3
assault without injury on a constable,0.151,0.015,1,1,3
"fraud, forgery etc associated with vehicle or driver records",0.145,0.015,1,1,3
making off without payment,0.14,0.014,1,1,3
"public fear, alarm or distress",0.136,0.014,1,1,3
criminal damage to a building other than a dwelling,0.108,0.011,1,1,3
criminal damage to a dwelling,0.108,0.011,1,1,3
criminal damage to a vehicle,0.108,0.011,1,1,3
other criminal damage,0.108,0.011,1,1,3
dishonest use of electricity,0.106,0.011,1,1,3
possession of controlled drugs (cannabis),0.085,0.008,1,1,3
possession of controlled drugs (excl. cannabis),0.085,0.008,1,1,3
soliciting for the purposes of prostitution,0.076,0.008,1,1,3
bail offences,0.066,0.007,1,1,3
causing death by aggravated vehicle taking,50,5,2,2,1
exploitation of prostitution,6,0.6,1,1,1
forgery or use of false drug prescription,0.145,0.015,1,1,3
other firearms offences,5,1,1,1,1